{
  "version": "1.0.0",
  "description": "ECDAT Cryptographic Algorithm and Protocol Risk Assessment Rules",
  "last_updated": "2026-09-04",
  "algorithms": [
    {
      "id": "md5",
      "canonical_name": "MD5",
      "category": "hash",
      "aliases": ["md5", "evp_md5", "mbedtls_md5", "wc_md5hash", "crypto.md5"],
      "classical_risk_level": "critical",
      "quantum_relevance": "grover_sensitive",
      "deprecation_notes": "MD5 is completely broken classically due to practical collision attacks (RFC 6151). Collision generation takes seconds.",
      "evidence_required": ["hash_call", "digest_output", "certificate_signature"],
      "remediation_hint": "Migrate immediately to SHA-256 or SHA-3/BLAKE3 for general hashing; Argon2id for password hashing.",
      "references": ["RFC 6151", "NIST SP 800-131A Rev 2"]
    },
    {
      "id": "sha1",
      "canonical_name": "SHA-1",
      "category": "hash",
      "aliases": ["sha1", "sha-1", "evp_sha1", "mbedtls_sha1", "wc_sha"],
      "classical_risk_level": "high",
      "quantum_relevance": "grover_sensitive",
      "deprecation_notes": "SHA-1 has proven practical collision attacks (SHAttered, Shambles). Forbidden for digital signatures and certificates by NIST since Dec 2022.",
      "evidence_required": ["hash_call", "tls_signature_algorithm", "certificate_signature"],
      "remediation_hint": "Upgrade to SHA-256, SHA-384, or SHA-3. For HMAC, SHA-1 is not broken by collisions but should be phased out.",
      "references": ["NIST SP 800-131A Rev 2", "CAB Forum Baseline Requirements"]
    },
    {
      "id": "sha224",
      "canonical_name": "SHA-224",
      "category": "hash",
      "aliases": ["sha224", "sha-224", "evp_sha224"],
      "classical_risk_level": "low",
      "quantum_relevance": "grover_sensitive",
      "deprecation_notes": "SHA-224 provides 112 bits of classical collision resistance. Being phased out in favor of SHA-256+.",
      "evidence_required": ["hash_call"],
      "remediation_hint": "Adopt standard SHA-256 for broader interoperability and 128-bit security level.",
      "references": ["FIPS 180-4"]
    },
    {
      "id": "sha256",
      "canonical_name": "SHA-256",
      "category": "hash",
      "aliases": ["sha256", "sha-256", "evp_sha256", "mbedtls_sha256"],
      "classical_risk_level": "none",
      "quantum_relevance": "grover_sensitive",
      "deprecation_notes": "Standard secure hash algorithm providing 128-bit collision resistance and 256-bit preimage resistance against classical attackers. Grover search reduces preimage to 128 bits, which remains secure.",
      "evidence_required": ["hash_call", "signature_hash"],
      "remediation_hint": "Compliant and secure for general applications.",
      "references": ["FIPS 180-4", "NIST SP 800-57 Part 1"]
    },
    {
      "id": "sha384",
      "canonical_name": "SHA-384",
      "category": "hash",
      "aliases": ["sha384", "sha-384", "evp_sha384"],
      "classical_risk_level": "none",
      "quantum_relevance": "grover_sensitive",
      "deprecation_notes": "Standard high-security hash algorithm providing 192-bit classical collision resistance. Recommended for CNSA Suite and Top Secret data.",
      "evidence_required": ["hash_call"],
      "remediation_hint": "Secure and recommended for high-security applications.",
      "references": ["FIPS 180-4", "NSA CNSA Suite"]
    },
    {
      "id": "sha512",
      "canonical_name": "SHA-512",
      "category": "hash",
      "aliases": ["sha512", "sha-512", "evp_sha512"],
      "classical_risk_level": "none",
      "quantum_relevance": "grover_sensitive",
      "deprecation_notes": "Standard high-security hash algorithm providing 256-bit collision resistance and 512-bit preimage resistance.",
      "evidence_required": ["hash_call"],
      "remediation_hint": "Secure and recommended for high-performance 64-bit architectures.",
      "references": ["FIPS 180-4"]
    },
    {
      "id": "sha3",
      "canonical_name": "SHA-3",
      "category": "hash",
      "aliases": ["sha3", "sha-3", "keccak", "sha3-256", "sha3-512"],
      "classical_risk_level": "none",
      "quantum_relevance": "grover_sensitive",
      "deprecation_notes": "Sponge-construction hash function resistant to length-extension attacks. Provides strong quantum security margin against Grover's algorithm.",
      "evidence_required": ["hash_call"],
      "remediation_hint": "State-of-the-art secure hash standard.",
      "references": ["FIPS 202"]
    },
    {
      "id": "rsa",
      "canonical_name": "RSA",
      "category": "asymmetric_encryption",
      "aliases": ["rsa", "rsa_generate_key_ex", "rsa_new", "pkcs1", "oaep"],
      "classical_risk_level": "low",
      "quantum_relevance": "shor_vulnerable",
      "conditions": [
        {
          "condition": "Key size < 2048 bits",
          "key_size_threshold_bits": 2048,
          "operator": "<",
          "classical_risk_level": "critical",
          "note": "RSA keys under 2048 bits are factorable or insecure against modern compute."
        },
        {
          "condition": "Key size == 2048 bits",
          "key_size_threshold_bits": 2048,
          "operator": "==",
          "classical_risk_level": "medium",
          "note": "2048-bit RSA provides 112-bit classical security; disallowed by NIST after 2030."
        },
        {
          "condition": "Key size >= 3072 bits",
          "key_size_threshold_bits": 3072,
          "operator": ">=",
          "classical_risk_level": "none",
          "note": "3072-bit and 4096-bit RSA provide 128-bit classical security, but completely vulnerable to Shor's algorithm on a CRQC."
        }
      ],
      "deprecation_notes": "All RSA variants are fully broken by Shor's algorithm on a Cryptographically Relevant Quantum Computer (CRQC), which factors integers in polynomial time.",
      "evidence_required": ["key_size", "certificate_public_key", "ast_rsa_api"],
      "remediation_hint": "Plan migration to ML-KEM (FIPS 203) for key encapsulation and ML-DSA / SLH-DSA (FIPS 204/205) for signatures. Use hybrid schemes (e.g. X25519+ML-KEM-768) during transition.",
      "references": ["NIST SP 800-57", "NIST FIPS 203", "NIST FIPS 204"]
    },
    {
      "id": "dsa",
      "canonical_name": "DSA",
      "category": "digital_signature",
      "aliases": ["dsa", "wc_dsasign", "wc_dsaverify"],
      "classical_risk_level": "critical",
      "quantum_relevance": "shor_vulnerable",
      "deprecation_notes": "DSA is deprecated in FIPS 186-5 for digital signature generation. Fragile to nonce reuse and broken by Shor's algorithm.",
      "evidence_required": ["signature_algorithm", "key_type"],
      "remediation_hint": "Migrate to Ed25519 classically or ML-DSA (FIPS 204) for post-quantum security.",
      "references": ["NIST FIPS 186-5"]
    },
    {
      "id": "ecdsa",
      "canonical_name": "ECDSA",
      "category": "digital_signature",
      "aliases": ["ecdsa", "ec_key_new_by_curve_name", "crypto/ecdsa", "webcrypto.ecdsa", "ec", "ecc", "ec-256", "ec-384", "ec-521", "ecc-256", "ecc-384", "ecc-521"],
      "classical_risk_level": "none",
      "quantum_relevance": "shor_vulnerable",
      "conditions": [
        {
          "condition": "Curve size < 256 bits (e.g. secp160r1, secp192r1)",
          "key_size_threshold_bits": 256,
          "operator": "<",
          "classical_risk_level": "critical",
          "note": "Curves smaller than 256 bits have inadequate classical security."
        },
        {
          "condition": "Curve P-256 or P-384",
          "key_size_threshold_bits": 256,
          "operator": ">=",
          "classical_risk_level": "none",
          "note": "Classically secure, but completely broken by Shor's algorithm on a CRQC."
        }
      ],
      "deprecation_notes": "Elliptic Curve Discrete Logarithm Problem (ECDLP) is solved in polynomial time by Shor's algorithm. All NIST and SECG curves will be broken by a CRQC.",
      "evidence_required": ["curve_name", "key_size", "signature_algorithm"],
      "remediation_hint": "Migrate to ML-DSA (FIPS 204) or stateful hash signatures (LMS/XMSS) for firmware. Use dual-signature hybrid schemes in interim.",
      "references": ["NIST FIPS 186-5", "NIST FIPS 204"]
    },
    {
      "id": "ecdh",
      "canonical_name": "ECDH",
      "category": "key_exchange",
      "aliases": ["ecdh", "ec_key", "secp256r1", "prime256v1", "secp384r1"],
      "classical_risk_level": "none",
      "quantum_relevance": "shor_vulnerable",
      "deprecation_notes": "Classically sound with curves >= 256 bits, but vulnerable to Harvest-Now-Decrypt-Later (HNDL) attacks because recorded key exchanges can be retroactively broken by Shor's algorithm.",
      "evidence_required": ["tls_cipher_suite", "key_exchange_group"],
      "remediation_hint": "Adopt hybrid key exchange combining X25519 or P-256 with ML-KEM-768 (X25519MLKEM768).",
      "references": ["IETF draft-ietf-tls-hybrid-design", "NIST FIPS 203"]
    },
    {
      "id": "dh",
      "canonical_name": "Diffie-Hellman",
      "category": "key_exchange",
      "aliases": ["dh", "diffie-hellman", "dh_new", "dhe"],
      "classical_risk_level": "medium",
      "quantum_relevance": "shor_vulnerable",
      "conditions": [
        {
          "condition": "DH group < 2048 bits",
          "key_size_threshold_bits": 2048,
          "operator": "<",
          "classical_risk_level": "critical",
          "note": "Logjam attack showed 1024-bit DH can be broken by nation-state classical compute."
        },
        {
          "condition": "DH group >= 2048 bits",
          "key_size_threshold_bits": 2048,
          "operator": ">=",
          "classical_risk_level": "low",
          "note": "Classically acceptable, but broken by Shor's algorithm on a CRQC."
        }
      ],
      "deprecation_notes": "Finite-field DH is computationally expensive, prone to small-subgroup attacks, and completely broken by Shor's algorithm.",